#DEFINITIONS,dc=http://purl.org/dc/elements/1.1/,,,,,,,,,,,,,,,,,
19,b,10,sonetto,ABABABAB CDB CDB,,11,"como lo ferro atra' no si vede,",1,0,0,1,0,0,1,0,0,1,
19,b,11,sonetto,ABABABAB CDB CDB,,11,ma sì lo tira signorevolmente;,0,1,0,1,0,0,0,0,0,1,
19,b,12,sonetto,ABABABAB CDB CDB,,11,e questa cosa a credere mi 'nvita,0,1,0,1,0,0,1,0,0,1,
19,b,13,sonetto,ABABABAB CDB CDB,,11,"ch'Amore sia, e dàmi grande fede",0,1,0,1,0,1,0,1,0,1,
19,b,14,sonetto,ABABABAB CDB CDB,,11,che tutor sia creduto fra la gente.,0,0,1,0,0,1,0,0,0,1,