#DEFINITIONS,dc=http://purl.org/dc/elements/1.1/,,,,,,,,,,,,,,,,,
#dc:conformsTo,ami.it/dataformat,,,,,,,,,,,,,,,,,
#dc:identifier,PierdellaVignaDiGirolamo2008,,,,,,,,,,,,,,,,,
#dc:description,Fellowship Marco Praloran 2013,,,,,,,,,,,,,,,,,
#dc:author,Pier della Vigna,,,# autore del componimento non del file,,,,,,,,,,,,,,
#dc:title,Rime,,,# titolo del componimento non del file,,,,,,,,,,,,,,
#dc:data,1200-01-01/1300-01-01,,,# periodo in cui è stata scritta l'opera nel seguente formato: termine post quem/termine ante quem aaaa-mm-gg/aaaa-mm-gg,,,,,,,,,,,,,,
#dc:source,"Di Girolamo, 2008",,,"# l'edizione da cui è stato tratto il testo nel seguente formato cognomeautore-cognomeautore, anno",,,,,,,,,,,,,,
#dc:source,http://id.sbn.it/bid/MIL0749010,,,# perma link dal sto https://opac.sbn.it/ relativo all'edizione usata per compilare i dati,,,,,,,,,,,,,,
#dc:source,https://docs.google.com/spreadsheets/d/1_N-5t_p0xGbnFpSfEyPZ1NEcP5A8WP3nVVDFXhQylDg/edit?usp=sharing,,,# file da cui è stato esportato,,,,,,,,,,,,,,
#dc:creator,Laura Facini,,,# autore principale della schedatura,,,,,,,,,,,,,,
#dc:contributor,,,,# eventuali collaboratori o correttori,,,,,,,,,,,,,,
#dc:publisher,Gruppo Padovano di Stilistica,,,# l'ente responsabile della schedatura,,,,,,,,,,,,,,
#dc:provenance,Fondazione Ezio Franceschini ONLUS,,,# l'affiliazione che ha inizialmente generato il dato,,,,,,,,,,,,,,
#dc:dateSubmitted,12/04/2022,,,# data di invio del dato al respository,,,,,,,,,,,,,,
#dc:dateAccepted,,,,# data nella quale il dato viene integrato nella nuova release,,,,,,,,,,,,,,
sigla,sottogruppo,numero_del_verso,metro,schema_metrico,congedo,tipo_verso,trascrizione_verso,accento_01,accento_02,accento_03,accento_04,accento_05,accento_06,accento_07,accento_08,accento_09,accento_10,irregolarità
1,,1,canzone,aBC aBC Def(f)ED,,7,Poi tanta caunoscenza,0,1,0,0,0,1,0,0,0,0,
1,,2,canzone,aBC aBC Def(f)ED,,11,e compimento di tutte bellore,0,0,0,1,0,0,1,0,0,1,
1,,3,canzone,aBC aBC Def(f)ED,,11,"senza mancare natura li à dato,",1,0,0,1,0,0,1,0,0,1,
1,,4,canzone,aBC aBC Def(f)ED,,7,no mi ven mai increscenza,0,0,0,1,0,1,0,0,0,0,
1,,5,canzone,aBC aBC Def(f)ED,,11,penare lungamente per suo amore:,0,1,0,0,0,1,0,0,0,1,
1,,6,canzone,aBC aBC Def(f)ED,,11,"quanto più peno e più serò inalzato,",1,0,0,1,0,1,0,1,0,1,
1,,7,canzone,aBC aBC Def(f)ED,,11,in sì gran sicuranza Amor m'à miso,0,0,1,0,0,1,0,1,0,1,
1,,8,canzone,aBC aBC Def(f)ED,,7,"in del suo gran valere,",0,0,1,0,0,1,0,0,0,0,
1,,9,canzone,aBC aBC Def(f)ED,,7,a cui son tutto dato,0,1,0,1,0,1,0,0,0,0,
1,,10,canzone,aBC aBC Def(f)ED,,5+6,"e infiammato - di sì bon volere,",0,0,0,1,0,0,0,1,0,1,
1,,11,canzone,aBC aBC Def(f)ED,,11,com'albore che d'ellera è sorpreso.,0,1,0,0,0,1,0,0,0,1,
1,,12,canzone,aBC aBC Def(f)ED,,7,Lo veder mi sotrasse,0,0,1,0,0,1,0,0,0,0,
1,,13,canzone,aBC aBC Def(f)ED,,11,"sì come il ferro fa la calamita,",0,1,0,1,0,1,0,0,0,1,
1,,14,canzone,aBC aBC Def(f)ED,,11,sì m'è viso ch'Amor mi sotraggesse;,1,0,1,0,0,1,0,0,0,1,
1,,15,canzone,aBC aBC Def(f)ED,,7,parse che mi furasse,1,0,0,0,0,1,0,0,0,0,
1,,16,canzone,aBC aBC Def(f)ED,,11,"subitamente cor e corpo e vita,",0,0,0,1,0,1,0,1,0,1,
1,,17,canzone,aBC aBC Def(f)ED,,11,ch'eo non son mio quanto un ago pungesse.,1,0,0,1,0,0,1,0,0,1,
1,,18,canzone,aBC aBC Def(f)ED,,11,Inn Amore ò dato tutto mio pensare,0,1,0,1,0,1,0,0,0,1,
1,,19,canzone,aBC aBC Def(f)ED,,7,"e 'n sua subiezione,",0,1,0,0,0,1,0,0,0,0,
1,,20,canzone,aBC aBC Def(f)ED,,7,ch'eo sono innamorato,0,1,0,0,0,1,0,0,0,0,
1,,21,canzone,aBC aBC Def(f)ED,,5+6,"ed alterato - di mia oppinione,",0,0,0,1,0,0,1,0,0,1,
1,,22,canzone,aBC aBC Def(f)ED,,11,che eo vo al morire e paremi ben fare.,1,0,0,1,0,0,1,0,0,1,
1,,23,canzone,aBC aBC Def(f)ED,,7,Son menato per forza,0,0,1,0,0,1,0,0,0,0,
1,,24,canzone,aBC aBC Def(f)ED,,11,"ed eo medesmo mi meno al morire,",0,1,0,1,0,0,1,0,0,1,
1,,25,canzone,aBC aBC Def(f)ED,,11,ed esser la mia morte e non vedere!,0,1,0,0,0,1,0,0,0,1,
1,,26,canzone,aBC aBC Def(f)ED,,7,Non ò tanta di possa,0,1,1,0,0,1,0,0,0,0,
1,,27,canzone,aBC aBC Def(f)ED,,11,"né di valor ch'eo isforzi 'l meo disire,",0,0,0,1,0,1,0,0,0,1,
1,,28,canzone,aBC aBC Def(f)ED,,11,così m'à tolto Amore ogne podere:,0,1,0,1,0,1,1,0,0,1,
1,,29,canzone,aBC aBC Def(f)ED,,11,di ciò mi dono gran confortamento,0,1,0,1,0,1,0,0,0,1,
1,,30,canzone,aBC aBC Def(f)ED,,7,"contra lo meo penare,",1,0,0,1,0,1,0,0,0,0,
1,,31,canzone,aBC aBC Def(f)ED,,7,che son da llei amato,0,1,0,1,0,1,0,0,0,0,
1,,32,canzone,aBC aBC Def(f)ED,,5+6,e incuminciato - m'àve a meritare:,0,0,0,1,0,1,0,0,0,1,
1,,33,canzone,aBC aBC Def(f)ED,,11,bon fine aspetta bon cominciamento.,0,1,0,1,0,1,0,0,0,1,
1,,34,canzone,aBC aBC Def(f)ED,,7,Sì alta cominzanza,0,1,0,0,0,1,0,0,0,0,
1,,35,canzone,aBC aBC Def(f)ED,,11,"Amor m'àve donato d'avenire,",0,1,1,0,0,1,0,0,0,1,
1,,36,canzone,aBC aBC Def(f)ED,,11,per ch'eo più aquisti ch'eo non ò mertato;,0,1,0,1,0,1,0,0,0,1,
1,,37,canzone,aBC aBC Def(f)ED,,7,"non giocai in fallanza,",0,0,1,0,0,1,0,0,0,0,
1,,38,canzone,aBC aBC Def(f)ED,,11,che sovente ved'omo adovenire,0,0,1,0,0,1,0,0,0,1,
1,,39,canzone,aBC aBC Def(f)ED,,11,amare fortemente e non è amato;,0,1,0,0,0,1,0,0,0,1,
1,,40,canzone,aBC aBC Def(f)ED,,11,poi ell'à tanto di caunoscimento,0,1,0,1,0,0,0,0,0,1,
1,,41,canzone,aBC aBC Def(f)ED,,7,d'Amor che la 'ntendenza,0,1,0,0,0,1,0,0,0,0,
1,,42,canzone,aBC aBC Def(f)ED,,7,"più mi fa ralegrare,",1,0,1,0,0,1,0,0,0,0,
1,,43,canzone,aBC aBC Def(f)ED,,5+6,"come de' fare - chi sì ben comenza,",1,0,0,1,0,1,0,1,0,1,
1,,44,canzone,aBC aBC Def(f)ED,,11,quant'à più de le donne insegnamento.,0,1,1,0,0,1,0,0,0,1,
2,,1,canzone,ABAB CDDC,,11,"Amore, in cui disio ed ò speranza,",0,1,0,1,0,1,0,0,0,1,
2,,2,canzone,ABAB CDDC,,11,"di voi, bella, m'à dato guiderdone,",0,1,1,0,0,1,0,0,0,1,
2,,3,canzone,ABAB CDDC,,11,"e guardomi infin che vegn'a speranza,",0,1,0,0,1,0,1,0,0,1,
2,,4,canzone,ABAB CDDC,,11,pur aspetando bon tempo e stagione.,1,0,0,1,0,0,1,0,0,1,
2,,5,canzone,ABAB CDDC,,11,"Com'om ch'è i· mare ed à spene di gire,",0,1,0,1,0,0,1,0,0,1,
2,,6,canzone,ABAB CDDC,,11,"e quando vede il tempo, ed ello spanna,",0,1,0,1,0,1,0,1,0,1,
2,,7,canzone,ABAB CDDC,,11,"e giamai la speranza no lo 'nganna,",0,0,1,0,0,1,0,0,0,1,
2,,8,canzone,ABAB CDDC,,11,"così facc'io, madonna, in voi venire.",0,1,0,1,0,1,0,1,0,1,
2,,9,canzone,ABAB CDDC,,11,"Or potess'eo venire a voi, amorosa,",1,0,0,1,0,1,0,1,0,1,
2,,10,canzone,ABAB CDDC,,11,"com' lo larone ascoso, e non paresse:",1,0,0,1,0,1,0,0,0,1,
2,,11,canzone,ABAB CDDC,,11,"be·l mi teria in gioia aventurusa,",1,0,0,1,0,1,0,0,0,1,
2,,12,canzone,ABAB CDDC,,11,se l'Amore tanto ben mi facesse.,0,0,1,0,1,0,1,0,0,1,
2,,13,canzone,ABAB CDDC,,11,"Sì bel parlante, donna, con voi fora,",0,1,0,1,0,1,0,0,1,1,
2,,14,canzone,ABAB CDDC,,11,"e direi como v'amai lungiamente,",0,0,1,1,0,0,1,0,0,1,
2,,15,canzone,ABAB CDDC,,11,"più ca Prïamo Tisbia dolzemente,",0,0,1,0,0,1,0,0,0,1,
2,,16,canzone,ABAB CDDC,,11,ed ameraggio infin ch'eo vivo ancora.,0,0,0,1,0,1,0,1,0,1,
2,,17,canzone,ABAB CDDC,,11,Vostro amor è che mi tiene in disiro,1,0,1,1,0,0,1,0,0,1,
2,,18,canzone,ABAB CDDC,,11,"e donami speranza con gran gioi,",0,1,0,0,0,1,0,0,0,1,
2,,19,canzone,ABAB CDDC,,11,ch'eo non curo s'io doglio od ò martiro,1,0,1,0,0,1,0,0,0,1,
2,,20,canzone,ABAB CDDC,,11,membrando l'ora ched io vegno a voi:,0,1,0,1,0,0,0,1,0,1,
2,,21,canzone,ABAB CDDC,,11,"ca, ss'io troppo dimoro, par ch'io pera,",0,1,1,0,0,1,0,0,0,1,
2,,22,canzone,ABAB CDDC,,11,"aulente lena, e voi mi perderete;",0,1,0,1,0,1,0,0,0,1,
2,,23,canzone,ABAB CDDC,,11,"adunque, bella, se ben mi volete,",0,1,0,1,0,0,1,0,0,1,
2,,24,canzone,ABAB CDDC,,11,guardate ch'io non mora in vostra spera.,0,1,0,1,0,1,0,1,0,1,
2,,25,canzone,ABAB CDDC,,11,"In vostra spera vivo, donna mia,",0,1,0,1,0,1,0,1,0,1,
2,,26,canzone,ABAB CDDC,,11,"e lo mio core adesso a voi dimanda,",0,0,0,1,0,1,0,1,0,1,
2,,27,canzone,ABAB CDDC,,11,e l'ora tardi mi pare che sia,0,1,0,1,0,0,1,0,0,1,
2,,28,canzone,ABAB CDDC,,11,che fino amore a vostro cor mi manda.,0,1,0,1,0,1,0,1,0,1,
2,,29,canzone,ABAB CDDC,,11,E guardo tempo che mi sia a piacimento,1,0,1,0,0,0,1,0,0,1,
2,,30,canzone,ABAB CDDC,,11,"e spanda le mie vele inver' voi, rosa,",0,1,0,0,0,1,0,0,1,1,
2,,31,canzone,ABAB CDDC,,11,e prendo porto là ove si riposa,0,1,0,1,0,1,0,0,0,1,
2,,32,canzone,ABAB CDDC,,11,lo meo core al vostro insegnamento.,0,0,1,0,0,1,0,0,0,1,
2,,33,canzone,ABAB CDDC,,11,"Mia canzonetta, porta esti compianti",1,0,0,1,0,1,1,0,0,1,
2,,34,canzone,ABAB CDDC,,11,"a quella ch'à 'n ballïa lo meo core,",0,1,0,1,0,1,0,0,0,1,
2,,35,canzone,ABAB CDDC,,11,"e le mie pene contale davanti,",0,0,0,1,0,1,0,0,0,1,
2,,36,canzone,ABAB CDDC,,11,e dille com'eo moro per su' amore;,0,1,0,0,0,1,0,0,0,1,
2,,37,canzone,ABAB CDDC,,11,e mandimi per suo messaggio a dire,0,1,0,0,0,1,0,1,0,1,
2,,38,canzone,ABAB CDDC,,11,com'io conforti l'amor ch'i' lei porto;,0,1,0,1,0,0,1,0,1,1,
2,,39,canzone,ABAB CDDC,,11,"e, s'io ver' lei feci alcuno torto,",0,1,0,1,1,0,0,1,0,1,
2,,40,canzone,ABAB CDDC,,11,donimi penitenza al suo volire.,1,0,0,0,0,1,0,0,0,1,
3,,1,canzone,ABC ABC CDeeDC,,11,"Amor, da cui move tutora e vene",0,1,0,0,1,0,0,1,0,1,
3,,2,canzone,ABC ABC CDeeDC,,11,"pregio e larghezza e tuta benenanza,",1,0,0,1,0,1,0,0,0,1,
3,,3,canzone,ABC ABC CDeeDC,,11,"vene ne l'om valente ed insegnato,",1,0,0,1,0,1,0,0,0,1,
3,,4,canzone,ABC ABC CDeeDC,,11,ch'e' non poria divisare lo bene,1,0,0,1,0,0,1,0,0,1,
3,,5,canzone,ABC ABC CDeeDC,,11,"che ne nasce ed avene, chi à leanza,",0,0,1,0,0,1,0,0,0,1,
3,,6,canzone,ABC ABC CDeeDC,,11,ond'eo ne sono in parte tralasciato;,0,1,0,1,0,1,0,0,0,1,
3,,7,canzone,ABC ABC CDeeDC,,11,ma sì dirò com'ello m'à locato,0,1,0,1,0,1,0,0,0,1,
3,,8,canzone,ABC ABC CDeeDC,,11,ed onorato più d'altr'amadore,0,0,0,1,0,1,1,0,0,1,
3,,9,canzone,ABC ABC CDeeDC,,7,"per poco di servire,",0,1,0,0,0,1,0,0,0,0,
3,,10,canzone,ABC ABC CDeeDC,,7,"ca, s'eo voglio ver dire,",0,0,1,0,0,1,0,0,0,0,
3,,11,canzone,ABC ABC CDeeDC,,11,"di tale guisa m'àve fatto onore,",0,1,0,1,0,0,0,1,0,1,
3,,12,canzone,ABC ABC CDeeDC,,11,ca sé à slocato e miso m'à 'n suo stato.,0,1,0,1,0,1,0,1,0,1,
3,,13,canzone,ABC ABC CDeeDC,,11,Stato sì rico ed alto non fue dato,1,0,0,1,0,1,0,0,0,1,
3,,14,canzone,ABC ABC CDeeDC,,11,"di sì poco servire, al meo parvente,",0,0,1,0,0,1,0,0,0,1,
3,,15,canzone,ABC ABC CDeeDC,,11,ond'eo mi tegno benaventuroso,0,1,0,1,0,0,0,0,0,1,
3,,16,canzone,ABC ABC CDeeDC,,11,e veio ben ch'Amor m'à più 'norato,0,1,0,1,0,1,0,0,0,1,
3,,17,canzone,ABC ABC CDeeDC,,11,"intra gl'altri amadori certamente,",1,0,1,0,0,1,0,0,0,1,
3,,18,canzone,ABC ABC CDeeDC,,11,ond'eo m'alegro e vivo più gioioso;,0,1,0,1,0,1,0,0,0,1,
3,,19,canzone,ABC ABC CDeeDC,,11,che m'à donato a quella ch'à per uso,0,0,0,1,0,1,0,0,0,1,
3,,20,canzone,ABC ABC CDeeDC,,11,"bellezze ed adornezze e piacimento,",0,1,0,0,0,1,0,0,0,1,
3,,21,canzone,ABC ABC CDeeDC,,7,e aunore e canoscenza,0,1,0,0,0,1,0,0,0,0,
3,,22,canzone,ABC ABC CDeeDC,,7,i· llei senza partenza,0,1,0,0,0,1,0,0,0,0,
3,,23,canzone,ABC ABC CDeeDC,,11,fanno soggiorno ed àlle al suo talento;,1,0,0,1,0,1,0,0,0,1,
3,,24,canzone,ABC ABC CDeeDC,,11,senno la guida e 'l fin pregio amoroso.,1,0,0,1,0,0,1,0,0,1,
3,,25,canzone,ABC ABC CDeeDC,,11,Pregio ed aunore adesa lei ed avanza,1,0,0,1,0,1,0,1,0,1,
3,,26,canzone,ABC ABC CDeeDC,,11,ed è dismisurata di gran guisa,0,1,0,0,0,1,0,0,0,1,
3,,27,canzone,ABC ABC CDeeDC,,11,d'avere tuto bene in provedenza,0,1,0,1,0,1,0,0,0,1,
3,,28,canzone,ABC ABC CDeeDC,,11,di lei ch'Amor m'à miso in sua possanza:,0,1,0,1,0,1,0,0,0,1,
3,,29,canzone,ABC ABC CDeeDC,,11,la caonoscente senza lung'atesa,0,0,0,1,0,1,0,1,0,1,
3,,30,canzone,ABC ABC CDeeDC,,11,mi meritao de la sua benvoglienza:,0,0,0,1,0,0,1,0,0,1,
3,,31,canzone,ABC ABC CDeeDC,,11,ch'assai val meglio poco di ben senza,0,1,0,1,0,1,0,0,1,1,
3,,32,canzone,ABC ABC CDeeDC,,11,"briga ed inoia ed affanno aquistato,",1,0,0,1,0,0,1,0,0,1,
3,,33,canzone,ABC ABC CDeeDC,,7,"co rico per ragione,",0,1,0,0,0,1,0,0,0,0,
3,,34,canzone,ABC ABC CDeeDC,,7,"poi che passa stagione,",1,0,1,0,0,1,0,0,0,0,
3,,35,canzone,ABC ABC CDeeDC,,11,e dell'om rico de' esser laudato:,0,0,0,1,0,0,1,0,0,1,
3,,36,canzone,ABC ABC CDeeDC,,11,però i' nonn ò fatto penitenza.,0,1,0,0,0,1,0,0,0,1,
3,,37,canzone,ABC ABC CDeeDC,,11,Penitenza non aggio fatta niente;,0,0,1,0,0,1,0,1,0,1,
3,,38,canzone,ABC ABC CDeeDC,,11,"al mio parvente, poco aggio servito,",0,0,0,1,0,1,1,0,0,1,
3,,39,canzone,ABC ABC CDeeDC,,11,ma tutavia seraggio servidore:,0,0,0,1,0,1,0,0,0,1,
3,,40,canzone,ABC ABC CDeeDC,,11,di tuto ch'Amor m'à fatto gaudente,0,1,0,0,1,0,1,0,0,1,
3,,41,canzone,ABC ABC CDeeDC,,11,"de l'avenente - per cui vado ardito,",0,0,0,1,0,0,1,1,0,1,
3,,42,canzone,ABC ABC CDeeDC,,11,più d'altro amante deo avere fin core;,1,0,0,1,0,0,1,0,0,1,
3,,43,canzone,ABC ABC CDeeDC,,11,e non vorei essere lo segnore,0,0,0,1,1,0,0,0,0,1,
3,,44,canzone,ABC ABC CDeeDC,,11,di tuto il mondo per aver perdita,0,1,0,1,0,0,0,1,0,1,
3,,45,canzone,ABC ABC CDeeDC,,7,"la sua benivoglienza,",0,1,0,0,0,1,0,0,0,0,
3,,46,canzone,ABC ABC CDeeDC,,7,"ch'i' aggio sanza temenza,",1,0,1,0,0,1,0,0,0,0,
3,,47,canzone,ABC ABC CDeeDC,,11,"che mi mantene 'n amorosa vita,",0,0,0,1,0,0,0,1,0,1,
3,,48,canzone,ABC ABC CDeeDC,,11,sì che ne sta contento lo mio core.,1,0,0,1,0,1,0,0,0,1,
3,,49,canzone,ABC ABC CDeeDC,,11,Lo mïo core tenesi contento,0,0,0,1,0,1,0,0,0,1,
3,,50,canzone,ABC ABC CDeeDC,,11,"del grande abento, ove amore m'à miso;",0,1,0,1,0,0,1,0,0,1,
3,,51,canzone,ABC ABC CDeeDC,,11,"mille grazze n'aggia a ciascun'ore,",1,0,1,0,1,0,0,0,1,1,
3,,52,canzone,ABC ABC CDeeDC,,11,ch'aggio tuto ciò che m'è a talento,1,0,1,0,1,0,1,0,0,1,
3,,53,canzone,ABC ABC CDeeDC,,11,"da l'amorosa donna col chiar viso,",0,0,0,1,0,1,0,0,0,1,
3,,54,canzone,ABC ABC CDeeDC,,11,che mi donò conforto con valore.,0,0,0,1,0,1,0,0,0,1,
3,,55,canzone,ABC ABC CDeeDC,,11,E non si poria pensare per core,0,0,0,0,1,0,1,0,0,1,
3,,56,canzone,ABC ABC CDeeDC,,11,com'à tute bellezze a compimento;,0,1,1,0,0,1,0,0,0,1,
3,,57,canzone,ABC ABC CDeeDC,,7,dunque eo non falleraggio,1,1,0,0,0,1,0,0,0,0,
3,,58,canzone,ABC ABC CDeeDC,,7,"se no 'nde parleraggio,",0,1,0,0,0,1,0,0,0,0,
3,,59,canzone,ABC ABC CDeeDC,,11,che lingua non po' avere in parlamento,0,1,0,0,0,1,0,0,0,1,
3,,60,canzone,ABC ABC CDeeDC,,11,di dire più che 'l cor sia pensatore.,0,1,0,1,0,1,0,0,0,1,
4,,1,canzonetta,abC abC d(d)EE,,7,Uno piagente sguardo,1,0,0,1,0,1,0,0,0,0,
4,,2,canzonetta,abC abC d(d)EE,,8,"coralmente m'à feruto,",0,0,1,0,0,0,1,0,0,0,
4,,3,canzonetta,abC abC d(d)EE,,11,"ond'eo d'Amore sentomi imfiamato,",0,1,0,1,0,1,0,0,0,1,
4,,4,canzonetta,abC abC d(d)EE,,7,ed è stato uno dardo,0,0,1,0,0,1,0,0,0,0,
4,,5,canzonetta,abC abC d(d)EE,,8,pungente e sì forte aguto,0,1,0,0,1,0,1,0,0,0,
4,,6,canzonetta,abC abC d(d)EE,,11,che mi passao lo core e m'à 'ntamato.,0,0,0,1,0,1,0,0,0,1,
4,,7,canzonetta,abC abC d(d)EE,,7,Or sono in tale mene,0,1,0,1,0,1,0,0,0,0,
4,,8,canzonetta,abC abC d(d)EE,,7+4,"e dico «Oi lasso mene, - com' faraggio,",0,1,0,1,0,1,0,1,0,1,
4,,9,canzonetta,abC abC d(d)EE,,11,se da madonna mia aiuto nonn aggio?»,0,0,0,1,0,1,1,0,0,1,
4,,10,canzonetta,abC abC d(d)EE,,7,"Li ochi mei c'incolparo,",1,0,1,0,0,1,0,0,0,0,
4,,11,canzonetta,abC abC d(d)EE,,8,"che volsero riguardare,",0,1,0,0,0,0,1,0,0,0,
4,,12,canzonetta,abC abC d(d)EE,,11,"ond'io n'ò riceputo male a torto,",0,1,0,0,0,1,0,1,0,1,
4,,13,canzonetta,abC abC d(d)EE,,7,quand'egli s'avisaro,0,1,0,0,0,1,0,0,0,0,
4,,14,canzonetta,abC abC d(d)EE,,8,"cogl'ochi suo' micidare,",0,1,0,1,0,0,1,0,0,0,
4,,15,canzonetta,abC abC d(d)EE,,11,e quegli ochi m'ànno conquiso e morto;,0,0,1,0,1,0,0,1,0,1,
4,,16,canzonetta,abC abC d(d)EE,,7,"la boca e li denti,",0,1,0,0,0,1,0,0,0,0,
4,,17,canzonetta,abC abC d(d)EE,,7+4,e li gesti piagenti - m'àn conquiso,0,0,1,0,0,1,0,0,0,1,
4,,18,canzonetta,abC abC d(d)EE,,11,e tute l'altre gioi de lo bel viso.,0,1,0,1,0,1,0,0,0,1,
4,,19,canzonetta,abC abC d(d)EE,,7,Traditrice ventura,0,0,1,0,0,1,0,0,0,0,
4,,20,canzonetta,abC abC d(d)EE,,8,"perché mi ci amenasti,",0,1,0,0,0,0,1,0,0,0,
4,,21,canzonetta,abC abC d(d)EE,,11,ca io non era ausato a esta partuta?,0,1,0,0,0,1,1,0,0,1,
4,,22,canzonetta,abC abC d(d)EE,,7,Volsi partire alora,1,0,0,1,0,1,0,0,0,0,
4,,23,canzonetta,abC abC d(d)EE,,8,"e tu mi asicurasti,",0,1,0,0,0,0,1,0,0,0,
4,,24,canzonetta,abC abC d(d)EE,,11,und'e' al cor aggio una mortal feruta:,0,0,1,1,0,0,0,1,0,1,
4,,25,canzonetta,abC abC d(d)EE,,7,non avea miso mente,0,0,0,1,0,1,0,0,0,0,
4,,26,canzonetta,abC abC d(d)EE,,7+4,"a lo viso piagente, - e poi guardai",0,0,1,0,0,1,0,1,0,1,
4,,27,canzonetta,abC abC d(d)EE,,11,in quello punto ed io m'inamorai.,0,1,0,1,0,1,0,0,0,1,
4,,28,canzonetta,abC abC d(d)EE,,7,Di quella inamoranza,0,1,0,0,0,1,0,0,0,0,
4,,29,canzonetta,abC abC d(d)EE,,8,"eo me ne sento tal doglia,",0,0,0,1,0,0,1,0,0,0,
4,,30,canzonetta,abC abC d(d)EE,,11,"che nulla medicina me non vale,",0,1,0,0,0,1,0,0,0,1,
4,,31,canzonetta,abC abC d(d)EE,,7,ancor tegno speranza,0,1,1,0,0,1,0,0,0,0,
4,,32,canzonetta,abC abC d(d)EE,,8,che si le muti la voglia,0,0,0,1,0,0,1,0,0,0,
4,,33,canzonetta,abC abC d(d)EE,,11,a quella che m'à fatto tanto male:,0,1,0,0,0,1,0,1,0,1,
4,,34,canzonetta,abC abC d(d)EE,,7,"ancor m'aggia ascondotto,",0,1,1,0,0,1,0,0,0,0,
4,,35,canzonetta,abC abC d(d)EE,,7+4,"e' diraggio altro motto, - ch'à disdire,",0,0,1,1,0,1,0,0,0,1,
4,,36,canzonetta,abC abC d(d)EE,,11,po' ch'ella vederà lo meo servire.,0,1,0,0,0,1,0,0,0,1,
4,,37,canzonetta,abC abC d(d)EE,,7,"Lasso, ch'io so' incapato,",1,0,1,0,0,1,0,0,0,0,
4,,38,canzonetta,abC abC d(d)EE,,8,veggiom'i· strana contrata,1,0,0,1,0,0,1,0,0,0,
4,,39,canzonetta,abC abC d(d)EE,,11,e son lontano da li miei paesi:,0,0,0,1,0,0,0,1,0,1,
4,,40,canzonetta,abC abC d(d)EE,,7,"amor m'à impelagato,",0,1,0,0,0,1,0,0,0,0,
4,,41,canzonetta,abC abC d(d)EE,,8,"furtuna m'è curuciata,",0,1,0,1,0,0,1,0,0,0,
4,,42,canzonetta,abC abC d(d)EE,,11,da poi che 'n questi tormenti mi misi.,0,1,0,1,0,0,1,0,0,1,
4,,43,canzonetta,abC abC d(d)EE,,7,E io non so ove mi gire:,1,0,1,0,0,1,0,0,0,0,
4,,44,canzonetta,abC abC d(d)EE,,7+4,"convenemi sofrire - este gran pene,",0,1,0,0,0,1,1,0,0,1,
4,,45,canzonetta,abC abC d(d)EE,,11,ca per durare male à l'omo bene.,0,0,0,1,0,1,0,1,0,1,
4,,46,canzonetta,abC abC d(d)EE,,7,Se de lo suo parlare,0,0,0,1,0,1,0,0,0,0,
4,,47,canzonetta,abC abC d(d)EE,,8,"non mi fosse tanto fera,",0,0,1,0,1,0,1,0,0,0,
4,,48,canzonetta,abC abC d(d)EE,,11,"dicesse alcuna cosa, al meo parere,",0,1,0,1,0,1,0,0,0,1,
4,,49,canzonetta,abC abC d(d)EE,,7,solo per confortare,1,0,0,0,0,1,0,0,0,0,
4,,50,canzonetta,abC abC d(d)EE,,8,"in ciò che mi disispera,",0,1,0,0,0,0,1,0,0,0,
4,,51,canzonetta,abC abC d(d)EE,,11,ch'eo mi pugnasse pur di ben servire;,1,0,0,1,0,1,0,0,0,1,
4,,52,canzonetta,abC abC d(d)EE,,7,"ca, ss'io fosse oltramare,",0,0,1,0,0,1,0,0,0,0,
4,,53,canzonetta,abC abC d(d)EE,,7+4,"converiami tornare - e· sta contrata,",0,0,1,0,0,1,0,0,0,1,
4,,54,canzonetta,abC abC d(d)EE,,11,ben faria cento miglia la giornata.,0,0,1,1,0,1,0,0,0,1,
4,,55,canzonetta,abC abC d(d)EE,,7,"Canzonetta piagente,",0,0,1,0,0,1,0,0,0,0,
4,,56,canzonetta,abC abC d(d)EE,,8,"poi ch'Amore lo comanda,",0,0,1,0,0,0,1,0,0,0,
4,,57,canzonetta,abC abC d(d)EE,,11,non tardare e vanne a la più fina;,0,0,1,0,0,1,0,0,0,1,
4,,58,canzonetta,abC abC d(d)EE,,7,saluta l'avenente,0,1,0,0,0,1,0,0,0,0,
4,,59,canzonetta,abC abC d(d)EE,,8,e dille ch'«A voi mi manda,0,1,0,0,1,0,1,0,0,0,
4,,60,canzonetta,abC abC d(d)EE,,11,un vostro fino amante di Mesina:,0,1,0,1,0,1,0,0,0,1,
4,,61,canzonetta,abC abC d(d)EE,,7,"mandavi esto cantare,",1,0,1,0,0,1,0,0,0,0,
4,,62,canzonetta,abC abC d(d)EE,,7+4,che vi deggia membrare - del suo amore;,0,0,1,0,0,1,0,0,0,1,
4,,63,canzonetta,abC abC d(d)EE,,11,mentre che vive è vostro servitore».,1,0,0,1,0,1,0,0,0,1,
5,,1,canzone,AaB AaB ccDeeD,,11,"Amando con fin core e con speranza,",0,1,0,0,0,1,0,0,0,1,
5,,2,canzone,AaB AaB ccDeeD,,7,di grande gio' fidanza,0,1,0,1,0,1,0,0,0,0,
5,,3,canzone,AaB AaB ccDeeD,,11,"donòmi Amor più ch'eo no meritai,",0,1,0,1,0,1,0,0,0,1,
5,,4,canzone,AaB AaB ccDeeD,,11,che m'inalzao coralmente d'amanza,0,0,0,1,0,0,1,0,0,1,
5,,5,canzone,AaB AaB ccDeeD,,7,da la cui rimembranza,0,0,1,0,0,1,0,0,0,0,
5,,6,canzone,AaB AaB ccDeeD,,11,lo meo coraggio non diparto mai;,0,0,0,1,0,0,0,1,0,1,
5,,7,canzone,AaB AaB ccDeeD,,7,e' non poria partire,0,0,0,1,0,1,0,0,0,0,
5,,8,canzone,AaB AaB ccDeeD,,7,"per tutto 'l meo volere,",0,1,0,0,0,1,0,0,0,0,
5,,9,canzone,AaB AaB ccDeeD,,11,"sì m'èste sua figura al core impressa,",0,1,0,0,0,1,0,1,0,1,
5,,10,canzone,AaB AaB ccDeeD,,7,ancor mi sia partente,0,1,0,0,0,1,0,0,0,0,
5,,11,canzone,AaB AaB ccDeeD,,7,da lei corporalmente,0,1,0,0,0,1,0,0,0,0,
5,,12,canzone,AaB AaB ccDeeD,,11,"la morte amara, crudele e ingressa.",0,1,0,1,0,0,1,0,0,1,
5,,13,canzone,AaB AaB ccDeeD,,11,"La morte m'èste amara, che l'amore",0,1,0,1,0,1,0,0,0,1,
5,,14,canzone,AaB AaB ccDeeD,,7,"mutòmi in amarore,",0,1,0,0,0,1,0,0,0,0,
5,,15,canzone,AaB AaB ccDeeD,,11,crudele che punio senza pensare,0,1,0,0,0,1,1,0,0,1,
5,,16,canzone,AaB AaB ccDeeD,,11,la sullimata stella de l'albore,0,0,0,1,0,1,0,0,0,1,
5,,17,canzone,AaB AaB ccDeeD,,7,"senza colpa a tuttore,",0,0,1,0,0,1,0,0,0,0,
5,,18,canzone,AaB AaB ccDeeD,,11,per cui servire mi credea salvare;,0,1,0,1,0,0,0,1,0,1,
5,,19,canzone,AaB AaB ccDeeD,,7,ingressa m'è la morte,0,1,0,1,0,1,0,0,0,0,
5,,20,canzone,AaB AaB ccDeeD,,7,"per afretosa sorte,",0,0,0,1,0,1,0,0,0,0,
5,,21,canzone,AaB AaB ccDeeD,,11,non aspettando fine naturale,0,0,0,1,0,1,0,0,0,1,
5,,22,canzone,AaB AaB ccDeeD,,7,di quella in cui natura,0,1,0,1,0,1,0,0,0,0,
5,,23,canzone,AaB AaB ccDeeD,,7,"mise tutta misura,",1,0,1,0,0,1,0,0,0,0,
5,,24,canzone,AaB AaB ccDeeD,,11,for che termin di morte corporale.,0,0,1,0,0,1,0,0,0,1,
5,,25,canzone,AaB AaB ccDeeD,,11,"Per tale termin mi compiango e doglio,",0,1,0,1,0,0,0,1,0,1,
5,,26,canzone,AaB AaB ccDeeD,,7,"perdo gioia e mi svoglio,",1,0,1,0,0,1,0,0,0,0,
5,,27,canzone,AaB AaB ccDeeD,,11,quando süa contezza mi rimembra,1,0,1,0,0,1,0,0,0,1,
5,,28,canzone,AaB AaB ccDeeD,,11,di quella ch'io amai e servir soglio:,0,1,0,1,0,1,0,0,1,1,
5,,29,canzone,AaB AaB ccDeeD,,7,"di ciò viver non voglio,",0,1,1,0,0,1,0,0,0,0,
5,,30,canzone,AaB AaB ccDeeD,,11,ma dipartire l'alma da le membra;,0,0,0,1,0,1,0,0,0,1,
5,,31,canzone,AaB AaB ccDeeD,,7,e faria ciò ch'eo dico,0,0,1,1,0,1,0,0,0,0,
5,,32,canzone,AaB AaB ccDeeD,,7,"se no ch'a lo nemico,",0,1,0,0,0,1,0,0,0,0,
5,,33,canzone,AaB AaB ccDeeD,,11,"che m'à tolta madonna, plageria,",0,0,1,0,0,1,0,0,0,1,
5,,34,canzone,AaB AaB ccDeeD,,7,"cioè la morte fera,",0,1,0,1,0,1,0,0,0,0,
5,,35,canzone,AaB AaB ccDeeD,,7,che non guarda cui fera:,0,0,1,0,0,1,0,0,0,0,
5,,36,canzone,AaB AaB ccDeeD,,11,per lei podire aucire io moriria.,0,1,0,1,0,1,0,0,0,1,
5,,37,canzone,AaB AaB ccDeeD,,11,No la posso aucire né vengiamento,0,0,1,0,1,0,0,0,0,1,
5,,38,canzone,AaB AaB ccDeeD,,7,prendere al meo talento,1,0,0,1,0,1,0,0,0,0,
5,,39,canzone,AaB AaB ccDeeD,,11,"più che darmi conforto e buona voglia,",0,0,1,0,0,1,0,1,0,1,
5,,40,canzone,AaB AaB ccDeeD,,11,ed ancor no mi sia a piacimento,0,0,1,0,0,1,0,0,0,1,
5,,41,canzone,AaB AaB ccDeeD,,7,"nessun confortamento,",0,1,0,0,0,1,0,0,0,0,
5,,42,canzone,AaB AaB ccDeeD,,11,tanto conforto ch'io vivo in doglia:,1,0,0,1,0,0,1,0,0,1,
5,,43,canzone,AaB AaB ccDeeD,,7,donqua vivendo eo,1,0,0,1,0,1,0,0,0,0,
5,,44,canzone,AaB AaB ccDeeD,,7,vegio del danno meo,1,0,0,1,0,1,0,0,0,0,
5,,45,canzone,AaB AaB ccDeeD,,11,"servendo Amor, cui la morte fa guerra,",0,1,0,1,0,0,1,0,0,1,
5,,46,canzone,AaB AaB ccDeeD,,7,e a lui serviraggio,0,0,1,0,0,1,0,0,0,0,
5,,47,canzone,AaB AaB ccDeeD,,7,mentre ch'eo viveraggio:,1,0,1,0,0,1,0,0,0,0,
5,,48,canzone,AaB AaB ccDeeD,,11,in suo domin remembranza mi serra.,0,0,0,1,0,0,1,0,0,1,
5,,49,canzone,AaB AaB ccDeeD,,11,"Rimembranza mi serra in suo domino,",0,0,1,0,0,1,0,0,0,1,
5,,50,canzone,AaB AaB ccDeeD,,7,und'e' ver' lui m'inchino,0,1,0,1,0,1,0,0,0,0,
5,,51,canzone,AaB AaB ccDeeD,,11,merzé chiamando a Amore che mi vaglia.,0,1,0,1,0,1,0,0,0,1,
5,,52,canzone,AaB AaB ccDeeD,,11,Vagliami Amore per cui non rifino,1,0,0,1,0,0,1,0,0,1,
5,,53,canzone,AaB AaB ccDeeD,,7,"ma senza speme affino,",0,1,0,1,0,1,0,0,0,0,
5,,54,canzone,AaB AaB ccDeeD,,11,ch'a lui servendo gio' m'è la travaglia.,0,1,0,1,0,1,1,0,0,1,
5,,55,canzone,AaB AaB ccDeeD,,7,"Donimi alcuna spene,",1,0,0,1,0,1,0,0,0,0,
5,,56,canzone,AaB AaB ccDeeD,,7,ma di cui mi sovene,0,0,1,0,0,1,0,0,0,0,
5,,57,canzone,AaB AaB ccDeeD,,11,"non voi' che men per morte mi sovegna,",0,1,0,1,0,1,0,0,0,1,
5,,58,canzone,AaB AaB ccDeeD,,7,di quella in cui son mise,0,1,0,1,0,1,0,0,0,0,
5,,59,canzone,AaB AaB ccDeeD,,7,"tutte bellezz'e assise,",1,0,0,1,0,1,0,0,0,0,
5,,60,canzone,AaB AaB ccDeeD,,11,senza le quale Amore in me non regna.,1,0,0,1,0,1,0,1,0,1,
19,b,1,sonetto,ABABABAB CDB CDB,,11,Pero ch'Amore no si pò vedere,0,1,0,1,0,0,0,1,0,1,
19,b,2,sonetto,ABABABAB CDB CDB,,11,"e no si tratta corporalemente,",0,0,0,1,0,0,0,0,0,1,
19,b,3,sonetto,ABABABAB CDB CDB,,11,manti ne son di sì folle sapere,1,0,0,1,0,0,1,0,0,1,
19,b,4,sonetto,ABABABAB CDB CDB,,11,che credeno ch'Amore sia nïente;,0,1,0,0,0,1,0,0,0,1,
19,b,5,sonetto,ABABABAB CDB CDB,,11,ma po' ch'Amore si face sentire,0,1,0,1,0,0,1,0,0,1,
19,b,6,sonetto,ABABABAB CDB CDB,,11,"dentro dal cor signoreggiar la gente,",1,0,0,1,0,0,0,1,0,1,
19,b,7,sonetto,ABABABAB CDB CDB,,11,molto maggiore pregio deve avere,1,0,0,1,0,1,0,1,0,1,
19,b,8,sonetto,ABABABAB CDB CDB,,11,che se 'l vedessen visibilemente.,0,0,0,1,0,0,0,0,0,1,
19,b,9,sonetto,ABABABAB CDB CDB,,11,Per la vertute de la calamita,0,0,0,1,0,0,0,0,0,1,
